{
  "schema": "laudo-pse-1.0",
  "artifact": {
    "suite": "pse-suite",
    "suite_version": "0.3.0",
    "schema_version": "laudo-pse-1.0",
    "catalog_hash": "33d5be7e85777045d0088c3f5f7a91e394c83c4be33cfeda519b6073be0420e3",
    "repo_commit": "6dad2fd7ce93262e7f5aa449fafbc3891dfbf038",
    "config_fingerprint": "abc123",
    "timestamp_utc": "2026-08-17T11:55:00Z",
    "modo": "pse_inventory"
  },
  "veredito": "conforme",
  "exit_code": 0,
  "packs": ["privacy", "security"],
  "checks_executados": ["P-01", "P-02", "S-04", "S-06"],
  "checks_pulados": [
    {"id": "P-07", "motivo": "N/A: sem endpoint de consentimento no escopo"}
  ],
  "checks_indeterminados": [],
  "checks_nao_habilitados": [
    {"id": "E-00", "motivo": "Trabalho A não habilitado"}
  ],
  "findings": [],
  "resumo": {"total_findings": 0, "por_severidade": {}},
  "cobertura": {"catalogo_total": 30, "implementados_nos_packs": 22, "executados": 4}
}
